{
  "$schema": "https://json-schema.org/draft/2020-12/schema",
  "$id": "https://github.com/kyletabor/video-editor-bot/contract/edit-plan.schema.json",
  "title": "Edit plan",
  "description": "The interface between bot/ (produces) and render/ (consumes). A plan is one source file, one output spec, and an ordered list of clips. Each clip is a keep-list of time segments from the source, concatenated in order. v1.1 adds an optional reel; v1.2 adds music, transitions, opening and closing cards; v1.3 adds transitions drawn by a Python module: the renderer also concatenates every clip, with optional slide cards, into one summary video. Nothing else is implied: no effects, no transitions, no re-encoding choices beyond what output.* states.",
  "type": "object",
  "additionalProperties": false,
  "required": [
    "version",
    "source",
    "output",
    "clips"
  ],
  "properties": {
    "version": {
      "type": "string",
      "const": "1",
      "description": "Contract version. Renderer must reject any other value. v1.1 fields are all optional, so v1 plans stay valid."
    },
    "source": {
      "type": "object",
      "additionalProperties": false,
      "required": [
        "path"
      ],
      "properties": {
        "path": {
          "type": "string",
          "minLength": 1,
          "description": "Path to the source video, relative to the repo root or absolute. Forward slashes only; the renderer normalizes for the OS."
        },
        "duration_seconds": {
          "type": "number",
          "exclusiveMinimum": 0,
          "description": "Optional. If present the renderer must reject any segment whose end exceeds it."
        },
        "captions": {
          "type": "object",
          "additionalProperties": false,
          "required": [
            "kind"
          ],
          "properties": {
            "kind": {
              "type": "string",
              "enum": [
                "embedded",
                "srt",
                "none"
              ],
              "description": "Where captions come from. embedded = subtitle stream in the source (e.g. Meet mov_text). srt = sidecar file at `path`. none = no captions available."
            },
            "path": {
              "type": "string",
              "description": "Required when kind = srt."
            }
          },
          "if": {
            "properties": {
              "kind": {
                "const": "srt"
              }
            }
          },
          "then": {
            "required": [
              "path"
            ]
          }
        }
      }
    },
    "output": {
      "type": "object",
      "additionalProperties": false,
      "required": [
        "dir"
      ],
      "properties": {
        "dir": {
          "type": "string",
          "minLength": 1,
          "description": "Directory the renderer writes into. Created if missing. Files are named <clip.id>.<container>."
        },
        "preset": {
          "type": "string",
          "enum": [
            "internal",
            "linkedin",
            "shorts",
            "email"
          ],
          "default": "internal",
          "description": "Destination preset. Sets defaults for aspect and encoding; explicit fields on output override the preset. See bot/research/clip-guidelines.md."
        },
        "aspect": {
          "type": "string",
          "enum": [
            "16:9",
            "9:16",
            "1:1"
          ],
          "default": "16:9",
          "description": "Output frame. 16:9 keeps the source frame. 9:16 and 1:1 center-crop unless a clip sets crop_focus."
        },
        "captions": {
          "type": "string",
          "enum": [
            "burn_in",
            "sidecar_srt",
            "none"
          ],
          "default": "burn_in",
          "description": "burn_in renders captions into the pixels. sidecar_srt writes <clip.id>.srt next to the video. Ignored when source.captions.kind = none."
        },
        "container": {
          "type": "string",
          "enum": [
            "mp4"
          ],
          "default": "mp4"
        },
        "max_height": {
          "type": "integer",
          "enum": [
            720,
            1080
          ],
          "default": 1080,
          "description": "Downscale ceiling. Never upscales."
        },
        "reel": {
          "type": "object",
          "additionalProperties": false,
          "description": "v1.1/v1.2. When present, the renderer ALSO writes one concatenated summary video: [intro] + [opening cards] + for each clip in order ([card] + clip) + [closing cards] + [outro]. Every segment is normalized to one size, frame rate and audio layout; cards carry silence (or the music bed) so audio is continuous. Individual clip files are still written exactly as in v1.",
          "properties": {
            "filename": {
              "type": "string",
              "pattern": "^[A-Za-z0-9][A-Za-z0-9._-]{0,79}\\.mp4$",
              "default": "reel.mp4",
              "description": "Written inside output.dir."
            },
            "intro": {
              "$ref": "#/$defs/card",
              "description": "Optional slide before the first clip."
            },
            "outro": {
              "$ref": "#/$defs/card",
              "description": "Optional slide after the last clip."
            },
            "chapter_cards": {
              "type": "string",
              "enum": [
                "auto",
                "all",
                "none"
              ],
              "default": "auto",
              "description": "auto = a card before a clip only when that clip carries its own `card`. all = every clip gets a card, synthesized from clip.takeaway when it has none. none = never."
            },
            "opening": {
              "type": "array",
              "maxItems": 2,
              "items": {
                "$ref": "#/$defs/card"
              },
              "description": "v1.2. Cards shown after the intro and before the first clip, e.g. 'What you'll learn'."
            },
            "closing": {
              "type": "array",
              "maxItems": 3,
              "items": {
                "$ref": "#/$defs/card"
              },
              "description": "v1.2. Cards shown after the last clip and before the outro: the takeaways / summary at the end."
            },
            "music": {
              "type": "object",
              "additionalProperties": false,
              "required": [
                "path"
              ],
              "description": "v1.2. A music bed. Plays under the intro, opening, chapter, closing and outro cards (under: cards), or under everything ducked below speech (under: all). Faded in/out at the edges of each card run. The file must be public domain or otherwise licensed for the project; see assets/music/LICENSE.",
              "properties": {
                "path": {
                  "type": "string",
                  "minLength": 1,
                  "description": "Repo-root-relative or absolute audio file (mp3/wav/ogg/m4a)."
                },
                "under": {
                  "type": "string",
                  "enum": [
                    "cards",
                    "all"
                  ],
                  "default": "cards"
                },
                "gain_db": {
                  "type": "number",
                  "minimum": -40,
                  "maximum": 0,
                  "default": -18,
                  "description": "Level of the bed relative to full scale when it is the only sound (under cards)."
                },
                "duck_db": {
                  "type": "number",
                  "minimum": -60,
                  "maximum": 0,
                  "default": -30,
                  "description": "Level of the bed under speech (only used with under: all)."
                },
                "fade_seconds": {
                  "type": "number",
                  "minimum": 0,
                  "maximum": 5,
                  "default": 1.0
                },
                "loop": {
                  "type": "boolean",
                  "default": true,
                  "description": "Loop the file if it is shorter than what it has to cover."
                }
              }
            },
            "transition": {
              "type": "object",
              "additionalProperties": false,
              "description": "v1.2. How one segment joins the next. cut = hard cut (v1.1 behaviour). dip = fade to black and back. dissolve = crossfade. module (v1.3) = a dissolve whose picture is drawn by the Python file named in `module`. Applied at every join between cards and clips.",
              "properties": {
                "kind": {
                  "type": "string",
                  "enum": [
                    "cut",
                    "dip",
                    "dissolve",
                    "module"
                  ],
                  "default": "cut"
                },
                "seconds": {
                  "type": "number",
                  "minimum": 0.1,
                  "maximum": 1.5,
                  "default": 0.4
                },
                "module": {
                  "type": "string",
                  "minLength": 4,
                  "pattern": "\\.py$",
                  "description": "v1.3. Repo-root-relative or absolute path to a Python file exposing render(a, b, t, state): a and b are HxWx3 uint8 RGB numpy arrays (outgoing and incoming frame at the same instant), t runs 0.0 to 1.0 over the transition, state is a dict that lives for one join; returns an HxWx3 uint8 RGB array. Required exactly when kind is module. The plan's `seconds` decides the length; a SECONDS constant in the file is advisory."
                }
              },
              "if": {
                "required": [
                  "kind"
                ],
                "properties": {
                  "kind": {
                    "const": "module"
                  }
                }
              },
              "then": {
                "required": [
                  "module"
                ]
              },
              "else": {
                "not": {
                  "required": [
                    "module"
                  ]
                }
              }
            },
            "audio_fade_seconds": {
              "type": "number",
              "minimum": 0,
              "maximum": 1,
              "default": 0.15,
              "description": "v1.2. Fade the clip audio in and out at every cut so speech never starts or stops abruptly."
            }
          }
        }
      }
    },
    "clips": {
      "type": "array",
      "minItems": 1,
      "maxItems": 50,
      "items": {
        "$ref": "#/$defs/clip"
      }
    },
    "summary": {
      "type": "object",
      "additionalProperties": false,
      "required": [
        "path"
      ],
      "description": "Optional companion document (executive summary + transcript). Produced by bot/, written here so render/ can copy it into output.dir. See veb-t2b.6.",
      "properties": {
        "path": {
          "type": "string",
          "minLength": 1
        }
      }
    }
  },
  "$defs": {
    "segment": {
      "type": "object",
      "additionalProperties": false,
      "required": [
        "start",
        "end"
      ],
      "properties": {
        "start": {
          "type": "number",
          "minimum": 0,
          "description": "Seconds from source start, inclusive."
        },
        "end": {
          "type": "number",
          "exclusiveMinimum": 0,
          "description": "Seconds from source start, exclusive. Must be > start."
        }
      }
    },
    "card": {
      "type": "object",
      "additionalProperties": false,
      "required": [
        "title"
      ],
      "description": "v1.1. A full-frame slide: dark background, a title, up to four lines of text, shown for `seconds` with silent audio. The renderer draws it; no image files are exchanged.",
      "properties": {
        "title": {
          "type": "string",
          "minLength": 1,
          "maxLength": 80
        },
        "lines": {
          "type": "array",
          "maxItems": 4,
          "items": {
            "type": "string",
            "minLength": 1,
            "maxLength": 120
          },
          "default": []
        },
        "seconds": {
          "type": "number",
          "minimum": 1,
          "maximum": 10,
          "default": 3
        }
      }
    },
    "clip": {
      "type": "object",
      "additionalProperties": false,
      "required": [
        "id",
        "takeaway",
        "segments"
      ],
      "properties": {
        "id": {
          "type": "string",
          "pattern": "^[a-z0-9][a-z0-9-]{0,63}$",
          "description": "Output file stem. Unique within the plan."
        },
        "takeaway": {
          "type": "string",
          "minLength": 1,
          "maxLength": 200,
          "description": "One sentence: the single idea this clip lands. Used for the title card / filename metadata / summary."
        },
        "segments": {
          "type": "array",
          "minItems": 1,
          "maxItems": 20,
          "items": {
            "$ref": "#/$defs/segment"
          },
          "description": "Keep-list. Rendered in array order and concatenated. Segments may be non-contiguous and out of source order. Total kept duration should stay within the preset's length bounds; the renderer warns but does not reject."
        },
        "hook_offset_seconds": {
          "type": "number",
          "minimum": 0,
          "default": 0,
          "description": "Offset within the concatenated clip where the payoff sentence starts. Informational for the renderer (title-card timing); the bot should already have ordered segments so this is 0."
        },
        "trim_silence": {
          "type": "boolean",
          "default": true,
          "description": "Renderer may tighten leading/trailing silence at segment boundaries by up to 0.5 s. Never removes speech."
        },
        "crop_focus": {
          "type": "string",
          "enum": [
            "center",
            "left",
            "right",
            "speaker"
          ],
          "default": "center",
          "description": "Only used when output.aspect is not 16:9. speaker = renderer's best effort; falls back to center."
        },
        "card": {
          "$ref": "#/$defs/card",
          "description": "v1.1. Optional explainer slide shown immediately before this clip in the reel (only used when output.reel is present)."
        }
      }
    }
  }
}
