{
  "version": "1",
  "source": {
    "path": "assets/demo-clip.mp4",
    "duration_seconds": 72,
    "captions": {
      "kind": "embedded"
    }
  },
  "output": {
    "dir": "out/demo-reel",
    "preset": "internal",
    "aspect": "16:9",
    "captions": "burn_in",
    "reel": {
      "filename": "reel.mp4",
      "intro": {
        "title": "Demo clip: key moments",
        "lines": [
          "Recorded 2026-09-25",
          "2 moments · 0:38"
        ],
        "seconds": 4
      },
      "outro": {
        "title": "That's the demo.",
        "lines": [
          "Transcript and summary ship alongside"
        ],
        "seconds": 3
      },
      "chapter_cards": "auto",
      "opening": [
        {
          "title": "What you'll learn",
          "lines": [
            "Why the recording format matters",
            "Whether a clip bot can work at all"
          ],
          "seconds": 5
        }
      ],
      "closing": [
        {
          "title": "Takeaways",
          "lines": [
            "Test the format before the bot",
            "Doubt is fine; write the goal down"
          ],
          "seconds": 6
        }
      ],
      "music": {
        "path": "assets/music/bed.mp3",
        "under": "cards",
        "gain_db": -18,
        "fade_seconds": 1.0
      },
      "transition": {
        "kind": "dip",
        "seconds": 0.4
      },
      "audio_fade_seconds": 0.15
    }
  },
  "clips": [
    {
      "id": "clip-01-can-we-use-this-for-our-video-bot",
      "takeaway": "Can we use this recording for our video bot?",
      "segments": [
        {
          "start": 16.0,
          "end": 28.0
        }
      ],
      "card": {
        "title": "Can we use this for our video bot?",
        "lines": [
          "Kyle tests the recording format"
        ],
        "seconds": 3
      }
    },
    {
      "id": "clip-02-questioning-the-clip-bot-idea",
      "takeaway": "I'm really questioning whether Ramsey's idea for a video clip bot is going to work.",
      "segments": [
        {
          "start": 36.0,
          "end": 52.0
        }
      ]
    }
  ]
}
